utterance_id	speaker_id	speaker_role_raw	utterance	Comment	X	Comments	session_id	annotation1	annotator_name1	annotator1_comment	annotation2	annotator_name2	annotator2_comment	Diff_annotations	keychild	speaker	role_adressee
3170	MOT	mother	tu reviens pour cinq heures hein pour Arthur .			 	Anae/2428.cha	FAT	clara						Anae	mother	Adult
3172	MOT	mother	ou alors tu l'emmènes avec toi .			 	Anae/2428.cha	FAT	clara						Anae	mother	Adult
4189	MOT	mother	< euh oui ça serait bien !	add à FAT		add à FAT 	Anae/2428.cha	FAT	clara						Anae	mother	Adult
4206	MOT	mother	non .			 	Anae/2428.cha	FAT	clara						Anae	mother	Adult
4217	MOT	mother	bah oui peut-être que tu ramènes la voiture .			 	Anae/2428.cha	FAT	clara						Anae	mother	Adult
4969	MOT	mother	bah tu l'as déposé avant l'heure ?	add à FAT	%act MOT prend CHI dans ses bras 	add à FAT %act MOT prend CHI dans ses bras 	Anae/2428.cha	FAT	clara						Anae	mother	Adult
